text,link
"(Want to get this briefing by email? Here’s the sign-up.) Good morning. Here’s what you need to know: • Russian election officials barred the opposition leader Aleksei Navalny, above center, from running in the presidential election scheduled for March. The decision was no surprise. “We won’t have an election because Vladimir Putin is horribly afraid,” Mr. Navalny said, calling for a boycott and street protests. Mr. Putin is widely expected to win. _____ • Our correspondents have the exclusive back story on the bizarre November resignation of Saad Hariri, Lebanon’s prime minister. The episode sheds light on the brash style of Prince Mohammed bin Salman, the Saudi crown prince. His gamble backfired: It failed to weaken Hezbollah, backed by Iran, and Mr. Hariri remains in office with new popularity. ",https://www.nytimes.com/2017/12/26/briefing/aleksei-navalny-turkey-meghan-markle.html?searchResultPosition=82
"The 40th Annual Kennedy Center Honors ceremony airs on CBS. And Christopher Nolan’s World War II epic is available to stream. KENNEDY CENTER HONORS 9 p.m. on CBS. While news of President Trump’s decision to skip this year’s Kennedy Center Honors — the first under his administration — might have taken over some of the conversation around the event, the attitude at the 40th edition of this annual ceremony honoring distinction in the performing arts was one of empowered defiance. This year’s honorees were the television producer Norman Lear, the rapper LL Cool J, the actress Carmen de Lavallade, and the singers Gloria Estefan and Lionel Richie. The ceremony includes performances and tributes from Stevie Wonder, Busta Rhymes, Luke Bryan, Rob Reiner and Meryl Streep, among others. SECRETS OF THE DEAD 9 p.m. on PBS (check local listings). A new documentary in PBS’s “Secrets of the Dead” series, “Secrets of Spanish Florida,” delves into the history of an early coastal European settlement in present-day Florida. Scientists, archaeologists and historians discuss the background and significance of the Spanish settlement, which, in addition to the Spanish, included people from Africa, Italy, Germany and Ireland. In the program, that conversation is tied to the current conversation about race and immigration. Jimmy Smits narrates. THE PROFIT 10 p.m. on CNBC. In this special episode of the business advice reality show, the host, Marcus Lemonis, travels to Puerto Rico, where he looks at recovery efforts in the wake of Hurricane Maria. TRAVELERS on Netflix. In this time-travel-centric Canadian sci-fi series, agents from the future are on a mission to save the world. “It’s hard to find a fresh take on the time-travel conceit,” Neil Genzlinger wrote of the first season. “But ‘Travelers’ has some attention-grabbing flourishes and fine acting.” The show’s second season aired in Canada this fall and is now streaming. DUNKIRK (2017) on iTunes and Amazon. Christopher Nolan’s World War II epic highlights the intimate: a masked British fighter pilot crammed in the cockpit of a spitfire; a father and two teenagers (one his son) steering a civilian yacht into a war zone; a group of Allied soldiers huddled and hidden in the body of a beached boat. The story is set in mid-1940, when about 400,000 Allied soldiers were trapped in the French port city from which the film takes its title. A rescue effort known as Operation Dynamo involved large numbers of civilian vessels. (For a glimpse of the bureaucratic side of this period, see “Darkest Hour,” currently in theaters.) The cast includes Tom Hardy, Mark Rylance, Fionn Whitehead and Harry Styles, and the plot flits between three different story lines and three different time frames. The director’s “elastic approach to narrative works beautifully in ‘Dunkirk,’” Manohla Dargis wrote in her review for The New York Times. “At one point, Mr. Nolan pulls the three narrative strands tightly together, creating a tremendous, enveloping sense of bone-deep dread.” ",https://www.nytimes.com/2017/12/26/arts/whats-on-tv-tuesday-kennedy-center-honors-and-dunkirk.html?searchResultPosition=81
"SEOUL, South Korea — North Korea will keep improving its nuclear and long-range ballistic missile capabilities next year to gain leverage to force Washington to make concessions, like the easing of sanctions, government and private analysts in South Korea said on Tuesday. The isolated North has made major strides this year in its nuclear weapons program but has also faced increasingly tough sanctions from the United Nations. On Sept. 3, it detonated what it called a hydrogen bomb in its sixth and most powerful nuclear test. It has also launched three intercontinental ballistic missiles this year, demonstrating rockets powerful enough to deliver warheads to all of the continental United States. After its last ICBM test, conducted Nov. 29, North Korea claimed to have completed building its nuclear force. But the country has yet to clear a key technological hurdle: proving that its warheads can survive re-entry into the atmosphere after flying through space, according to Western officials and analysts. Forecasting North Korea’s nuclear weapons program for the new year, the Unification Ministry in South Korea said on Tuesday that the North “will continue to advance its nuclear and missile capabilities” in 2018 despite its claims about completing its nuclear force. North Korea will conduct at least one more missile test to master the re-entry technology for its warheads, analysts said. But the North also was racing against time to secure full ICBM capabilities before new United Nations sanctions begin squeezing its economy, they said. “Re-entry is a question North Korea must solve to boost its negotiating leverage and for its military and technological purposes,” Shin Beom-chul, a security analyst, said in a report published over the weekend by the government-run Institute of Foreign Affairs and National Security in Seoul. “For North Korea, there is a big difference between entering negotiations with the United States after acquiring full ICBM capabilities and starting such talks without them.” ",https://www.nytimes.com/2017/12/26/world/asia/north-korea-nuclear-missile-tests.html?searchResultPosition=80
"Eric Schneiderman, New York’s attorney general, reached a milestone of sorts recently. By moving to sue the Federal Communications Commission over net neutrality this month, his office took its 100th legal or administrative action against the Trump administration and congressional Republicans. His lawyers have challenged Mr. Trump’s first, second and third travel bans and sued over such diverse matters as a rollback in birth control coverage and a weakening of pollution standards. They have also unleashed a flurry of amicus briefs and formal letters, often with other Democratic attorneys general, assailing legislation they see as gutting consumer finance protections or civil rights. “We try and protect New Yorkers from those who would do them harm,” Mr. Schneiderman said during a recent interview in his Manhattan office. “The biggest threat to New Yorkers right now is the federal government, so we’re responding to it.” In Mr. Schneiderman’s seventh year as attorney general, the office has been transformed into a bulwark of resistance amid an unusually expansive level of confrontation with the federal government. Other Democratic state attorneys general are undertaking similar efforts, often in concert, like Xavier Becerra in California, where extra money was set aside in the budget for the attorney general to battle the Trump administration. How far Mr. Schneiderman is willing to go in taking on Mr. Trump could define his political career, particularly in a blue state where disapproval of the president is high. The potential of the attorney general’s office for troublemaking and generating national headlines was redefined in the early 2000s by Eliot Spitzer. Mr. Schneiderman is a less combative man who was often the target of Mr. Trump’s Twitter wrath amid a three-year civil investigation into Trump University. In the end, Mr. Schneiderman’s office extracted a $25 million settlement in the case. Nonetheless, Mr. Schneiderman is seen by some as a possible backstop should the president exercise his pardon power to help those who might become ensnared in the investigation of possible Russian involvement in the 2016 presidential election being led by Robert S. Mueller III, the special counsel. Federal pardons do not apply to violations of state law. In the interview, Mr. Schneiderman would say little about his potential role as a criminal prosecutor in relation to the Trump administration, except that he hoped it would not come to that. Earlier this year, Mr. Schneiderman began a criminal inquiry focused on allegations of money laundering by Paul Manafort, Mr. Trump’s former campaign chairman. But his office stood down, at least temporarily, out of deference to the special counsel’s inquiry; the offices did not work together, his staff said. ",https://www.nytimes.com/2017/12/26/nyregion/eric-schneiderman-attorney-general-new-york.html?searchResultPosition=79
"The Reader Center is one way we in the newsroom are trying to connect with you, by highlighting your perspectives and experiences and offering insight into how we work. WEST FRANKFORT, Ill. — The first time I came to this small Southern Illinois city, in February, the person I was here to write about — Juan Carlos Hernandez Pacheco — was nowhere to be found. He was locked up in a Missouri detention facility. Mr. Hernandez had been arrested for being undocumented, amid a national conversation over President Trump’s promises to crack down on illegal immigration. So everything I learned during that visit about Mr. Hernandez — just Carlos to the 8,000 residents of West Frankfort — came from his neighbors here, in a community that had voted overwhelmingly for Mr. Trump. Their views on Mr. Hernandez felt like a rare chance to look at the complicated, unexpected ways that federal policy was playing out inside one town. In letters to the immigration court that could decide whether he will be deported, influential residents raved about Mr. Hernandez, someone most people in this mostly white coal-mining crossroads had not realized had been living here without papers for about 20 years. ",https://www.nytimes.com/2017/12/26/reader-center/juan-carlos-hernandez-pacheco.html?searchResultPosition=76
"Home for the holidays after passing the eighth-largest tax cut in United States history, Republicans could be forgiven for reveling in the warm embrace of nostalgia. Who among them won’t raise a glass to Ronald Reagan, a welcome ghost of administrations past, the revered Republican president whose first State of the Union address promised the biggest tax cut ever to “expand our national prosperity, enlarge national incomes and increase opportunities for all Americans”? Speaker Paul D. Ryan might chuckle fondly at Reagan’s tale of woe from a worker in the Midwest — a precursor to Mr. Ryan’s “Cindy”— who made the everyman’s case for a tax cut by complaining, “I’m bringing home more dollars than I ever believed I could possibly earn, but I seem to be getting worse off.” For all the backslapping over a job well done, however, Republicans are proving notably more reluctant to acknowledge the true impact of the tax changes that Reagan wrought. That’s because Reagan’s cuts didn’t quite work as advertised. Gross domestic product grew quickly during his two terms, averaging about 3.5 percent a year, pretty decent compared with the current measly pace. For one in two Americans, though — those in the bottom half of the income pile — income actually shrank on Reagan’s watch. In 1980, the year he was elected, they earned $16,371 a year on average, in today’s dollars, according to the World Wealth and Income Database. By 1988, Reagan’s last year in office, they had to make do with $16,268. ",https://www.nytimes.com/2017/12/26/business/economy/tax-cuts-incomes.html?searchResultPosition=78
"Good morning. (Want to get California Today by email? Here’s the sign-up.) The fires that ripped across California have produced a round of commentary about the perils that come with living in this state. It is nothing new. California has inspired a whole genre of literature and film over the years: dark and apocalyptic, with a disaster lurking behind every stunning sunset illuminating those late-afternoon winter surfers on the Pacific. “Wildfires are the price Angelenos pay to live in a city that straddles mountains, builds housing into hillsides, and threads communities through brush-filled canyons,” The Atlantic wrote this month. “We pick this poison, in place of living with tornadoes or hurricanes or winter storms where ice falls from the sky and blankets whole regions.” Over the decades, California — in films and books — has been pummeled by earthquakes, tidal waves and fires. It has been invaded by aliens. Film noir has flourished, particularly in Los Angeles, a city that seems perfect for setting dark, creepy and pessimistic films. Why are people picking on California? Well, for one thing, there is some truth here: This state is a place of wildfires, mudslides, catastrophic flooding and earthquakes. “When people come to California and they see the hills decked with poppies — everything is beautiful — they expect this is the norm,” said Mike Davis, a Southern California historian who recently wrote about the fires in a New Yorker essay. “The promotion of California as this paradise is a fundamental misrecognition of the nature of the environment that people live in.” But could there also be a whisper of East Coast resentment — or shall we say schadenfreude — from out-of-state commentators who, understandably, might be irritated by, to use a seasonal example, the cheery “Merry Christmas from the Santa Monica beach!” Instagram posts that pop up this time of year. Some people, as Mr. Davis noted, just don’t love California. ",https://www.nytimes.com/2017/12/26/us/california-today-dark-depictions-of-a-sunny-state.html?searchResultPosition=74
"Former Gov. Mike Huckabee of Arkansas drew a swift and intense response with a provocative claim on Tuesday: President Trump, he wrote, is similar to Winston Churchill, one of history’s most iconic leaders. Mr. Huckabee had just watched “Darkest Hour,” a film about Churchill. It was, he wrote on Twitter, a reminder of “what real leadership looks like.” “Churchill was hated by his own party, opposition party, and press,” he tweeted. “Feared by King as reckless, and despised for his bluntness. But unlike Neville Chamberlain, he didn’t retreat. We had a Chamberlain for 8 yrs; in @realDonaldTrump we have a Churchill.” Likening modern leaders to Chamberlain and Churchill — something Mr. Huckabee has done before — is always a loaded proposition. Chamberlain, who preceded Churchill as prime minister of Britain, tried to appease Hitler by conceding Czechoslovakia’s Sudetenland region to Nazi Germany in the 1938 Munich Agreement, and his name has come to be synonymous with weakness in the face of evil. Churchill, by contrast, was an officer in the British Army during World War I; led Britain through World War II as prime minister from 1940 to 1945; and handled several foreign policy crises in a second term as prime minister from 1951 to 1955. He was known for his skill as an orator and writer, and won the Nobel Prize in Literature in 1953. ",https://www.nytimes.com/2017/12/26/us/politics/mike-huckabee-trump-churchill.html?searchResultPosition=61
"MOSCOW — Aleksei A. Navalny, a Russian anticorruption activist, would have no real chance of defeating President Vladimir V. Putin in an election. The authorities have cast him as an utterly irrelevant showboat. But on Monday the Kremlin barred him from running for president in March. Then on Tuesday, threatening legal action, it warned him against organizing a boycott of the election. In one surreal turn after another, the Russian authorities have dismissed Mr. Navalny, a charismatic and canny street politician, as a nonentity — and then have done everything in their power to make sure that is the case. The boycott warning came from Mr. Putin’s spokesman, and was issued the same day the president, who has been in power for almost 18 years, was formally nominated to seek a fourth term. In barring Mr. Navalny from running, the Central Election Commission cited his suspended prison sentence in a fraud case. The activist, backed by the European Court of Human Rights and the Council of Europe, has denounced the prosecution as politically motivated. Mr. Navalny’s exclusion from the March election “casts a serious doubt on political pluralism in Russia and the prospect of democratic elections next year,” the European Union’s foreign service said in a statement on Tuesday. ",https://www.nytimes.com/2017/12/26/world/europe/russia-putin-navalny-election.html?searchResultPosition=62
"This article is part of the Opinion Today newsletter. You can sign up here to receive the newsletter each weekday. As is probably obvious, I rely heavily on other publications — competitors of The New York Times — in putting together this newsletter. So to kick off this week’s year-in-review series for the newsletter, I’m turning it over to top editors from those publications. I asked each of them to recommend one piece they published in 2017 — not necessarily their favorite (few editors will admit to having a favorite) but one worth rereading at year’s end. The exercise was a whole lot of fun and led me to read some fabulous pieces I hadn’t yet read. I hope you enjoy. I’ve grouped them into four categories. Trump, year one “What makes America great?” The Weekly Standard, by Daniel Krauthammer “John Boehner unchained,” Politico, by Tim Alberta “What a presidential president would have said about Charlottesville,” The Washington Post, by the editorial board “Why facts don’t change our minds,” The New Yorker, by Elizabeth Kolbert “It’s time: Congress needs to open a formal impeachment inquiry,” Lawfare, by Jane Chong and Benjamin Wittes #metoo “This moment isn’t (just) about sex. It’s really about work,” New York magazine, by Rebecca Traister “Instead of mourning great art tainted by awful men, mourn the work we lost from their victims,” Vox, by Caroline Framke “A panic is not an answer,” New York Daily News, by Christina Hoff Sommers Other big political issues “Ice apocalypse,” Grist, by Eric Holthaus “Taking on the scourge of opioids,” National Affairs, by Sally Satel “The cloak of ‘fear,’” Slate, by Jamelle Bouie “I’m a black daughter of the Confederacy, and this is how we should deal with all those General Lees,” The Los Angeles Times, by Lisa Richardson “Why do people hate Obamacare, anyway?” Kaiser Health News, by Julie Rovner “How middle-class America got fleeced,” Bloomberg View, by Noah Smith “You’re hired!” Democracy, by Jeff Spross “The paradox of prosperity,” Foreign Policy, by Ty McCormick Politics isn’t everything “There’s no such thing as ‘sound science,’” FiveThirtyEight, by Christie Aschwanden “Death at a Penn State fraternity,” The Atlantic, by Caitlin Flanagan “How smartphones hijack our minds,” The Wall Street Journal, by Nicholas Carr “Love in the time of robots,” Wired and Epic, by Alex Mar “Joni Mitchell: Fear of a female genius,” The Ringer, by Lindsay Zoladz A postscript: Most editors couldn’t resist sending the names of two or three pieces, and I then chose one of them. If you’re a journalist at one of these publications and your work doesn’t appear above, I suggest assuming that your boss included your piece and I failed to include it. ",https://www.nytimes.com/2017/12/26/opinion/2017-reading-list.html?searchResultPosition=75
"GOLDSBORO, N.C. — Among President Trump’s worrisome nominees to the judiciary, perhaps none is as alarming as Thomas Alvin Farr, a protégé of Jesse Helms, the former North Carolina senator, and a product of the modern white supremacist machine that Mr. Helms pioneered. Mr. Farr, nominated to serve on the United States District Court for the Eastern District of North Carolina, began his career as counsel for Mr. Helms’s Senate campaigns, where he participated in racist tactics to intimidate African-American voters. This alone is reason to reject his nomination, as is his apparent lying on the topic to the Senate Judiciary Committee. But Mr. Farr’s connections to Mr. Helms’s white supremacist causes and political network go much deeper. Having lived in North Carolina since childhood, I know Mr. Helms’s racist legacy and I hold no doubts that Mr. Farr perpetuates it. An unabashed segregationist, Mr. Helms was affiliated with the Council of Conservative Citizens, an outgrowth of the White Citizens’ Councils that promoted white supremacy. Mr. Helms, who served in the Senate for 30 years, used his honorable seat to support the apartheid regime in South Africa while opposing desegregation, civil rights legislation and the creation of the Martin Luther King’s Birthday holiday in this country. Mr. Helms also belittled Carol Moseley Braun, the only black senator at the time, by singing “Dixie” to her in the Senate elevator. Mr. Farr’s former law partner, Thomas Ellis, was Mr. Helms’s top deputy for decades. He also served as a director of the Nazi-inspired, pro-eugenics Pioneer Fund and used funding from that organization to create and bankroll a network of interlocking organizations to support Mr. Helms and other political candidates who espoused the notion of a superior white race and opposed civil rights. Together, Mr. Helms, Mr. Ellis, and their protégé Mr. Farr unleashed a huge propaganda machine that incited hostility toward African-Americans. Mr. Farr served as a lead counsel to Mr. Helms’s 1990 Senate campaign, which ran the now-infamous “White Hands” TV television ad, designed to inflame white voter anxiety over Mr. Helms’s black opponent, Harvey Gantt. It showed a pair of white hands balling up a rejection letter while a voice said: “You needed that job and you were the best qualified. But they had to give it to a minority because of a racial quota.” The same campaign also sent more than 100,000 intimidating postcards to North Carolinians, most of whom were blacks eligible to vote, wrongly suggesting they were ineligible and warning that they could be prosecuted for fraud if they tried to cast ballots. ",https://www.nytimes.com/2017/12/26/opinion/william-barber-trumps-judge-farr.html?searchResultPosition=64
"WASHINGTON — The Affordable Care Act was conceived as a mix of publicly funded health care and privately purchased insurance, but Republican attacks, culminating this month in the death of a mandate that most Americans have insurance, are shifting the balance, giving the government a larger role than Democrats ever anticipated. And while President Trump insisted again on Tuesday that the health law was “essentially” being repealed, what remains of it appears relatively stable and increasingly government-funded. In short, President Barack Obama’s signature domestic achievement is becoming more like what conservatives despise — government-run health care — thanks in part to Republican efforts that are raising premiums for people without government assistance and allowing them to skirt coverage. By ending the tax penalty for people who do not have coverage, beginning in 2019, Republicans may hasten the flight of customers who now pay the full cost of their insurance. Among those left behind under the umbrella of the Affordable Care Act would be people of modest means who qualify for Medicaid or receive sizable subsidies for private insurance. “Republicans have inadvertently strengthened the hand of Democrats like me who prefer richer subsidies to a mandate and welcome the expanded federal role that will come with those subsidies,” said Joel S. Ario, a former insurance commissioner from Pennsylvania who worked in the Obama administration. In days, the Trump administration is expected to carry out an executive order with proposed rules that would allow people to buy less expensive — and less comprehensive — coverage, through either business and professional associations or short-term private policies. ",https://www.nytimes.com/2017/12/26/us/politics/republicans-trump-affordable-care-act-obamacare.html?searchResultPosition=65
"(Want to get this briefing by email? Here’s the sign-up.) Good evening. Here’s the latest. 1. The Department of Homeland Security is increasingly going global. Set up to defend the United States, the department now has an estimated 2,000 employees deployed to more than 70 countries around the world. Above, an operation in South Africa targeting a Nigerian fraud ring. The costs of the operations have raised questions by critics in the U.S., and by some allies who say the department’s foreign reach is a stretch. _____ 2. How far New York’s attorney general is willing to go in taking on President Trump could define his political career. ",https://www.nytimes.com/2017/12/26/briefing/homeland-security-uber-peru.html?searchResultPosition=66
