text,link
"To travel the liberal byways of social media over recent weeks was to learn that Donald Trump was on the precipice of axing Robert Mueller and was likely to use the days just before Christmas, when we were distracted by eggnog and mistletoe, to lower the blade. Christmas has come. Christmas has gone. Mueller has not. To listen to Nancy Pelosi and other Democratic leaders, the tax overhaul that Trump just signed into law is no mere plutocratic folly. It’s “Armageddon” (Pelosi’s actual word). Their opposition is righteous, but how will millions of voters who notice smaller withholdings from their paychecks and more money in their pockets square that seemingly good fortune with such prophecies of doom on a biblical scale? Some of these Americans may decide that the prophets aren’t to be trusted — and that the president isn’t quite the pestilence they make him out to be. I’m not minimizing Trump’s capriciousness or cupidity. He could yet fire Mueller, the special counsel. Some conservatives’ intensifying attacks on the counsel and the F.B.I. are clearly grist for that. And the tax bill is indeed a messy, fiscally reckless means for Republican lawmakers to please their donors and crow that they are getting big things done. But the end of the world? Come on. That’s not par-for-the-course hyperbole. It’s peculiar-to-Trump hyperventilation, an understandable response to such an indecent president but quite possibly a tactical mistake. It could weaken the odds of hobbling him next fall, in the midterm elections, and of putting him far behind us in November 2020. And that’s where I, for one, want him: in the rearview mirror, growing tinier and tinier as we zoom, pedal to the metal, toward a saner, more dignified horizon. ",https://www.nytimes.com/2017/12/26/opinion/trump-liberals-armageddon.html?searchResultPosition=67
"From my window in Brooklyn Heights, I’ve watched the Staten Island ferry come and go for more than two years now, a big orange boat crisscrossing the water. That’s when I’m home, which is not much. At night, I hear the foghorn, a reassuring sound, fading slowly like memories. On the road, in yet another hotel room where my hand can’t locate by instinct the light switch, I imagine that sound sometimes. It makes me smile. Home is little things, the clunk of the door closing on your world. There’s a lot going on out my window: joggers on the promenade, barges plowing the East River, choppers landing on the prow of Manhattan, planes nosing down into Newark Airport, cars on the first traffic-free stretch of F.D.R. Drive where hope surges only to collide with reality at a bottleneck. The view always reminds me of a children’s picture book. Yes, my love, that’s a helicopter. I don’t look out on all that enough. Water is life, a mirror one day, a maelstrom the next. Do I live in New York or camp in it? Sometimes I wonder. I resent the inevitable question: How long are you in town for? Forever, I feel like saying. That’s right, the farthest I’m going for the next six months is the convenience store on Montague. Home’s important. Belonging is important, right there behind love in terms of human needs. Watching an old movie on your couch is important. That’s what holidays are for. I watched “Shampoo,” a minor Hal Ashby masterpiece. “You never stop moving,” Jill (Goldie Hawn) tells her feckless hairdresser boyfriend, George (Warren Beatty). “You never go anywhere.” The movie’s set on the eve of Nixon’s 1968 election. A TV blares in the background. There’s Nixon. He says the American flag won’t be “a doormat.” He says “the great objective” of his administration will be to “bring the American people together.” ",https://www.nytimes.com/2017/12/26/opinion/2018-deferred-dreams.html?searchResultPosition=63
"THE GRAPHIC CANON OF CRIME AND MYSTERY, VOLUME 1 Edited by Russ Kick. (Seven Stories Press, $29.95.) From Poe to Kafka to Dostoyevsky, all the masters are here, in these short, graphic renderings of the darkest, most foreboding writing of all time. With different artists and illustrators taking on each tale, there are many revelations. TIME OF GRATITUDE By Gennady Aygi. (New Directions, $16.95.) This collection of poetry and verse-infused prose from the celebrated Russian and Chuvash poet bows to the writers and artists who kept him creatively inspired during the Soviet era. YOU & ME & WHY WE ARE IN LOVE By Aurelia Alcaïs. (Penguin, $15.) Love comes in many flavors and Alcaïs, a French actress and illustrator, tries to capture many of them in her basic but sweet portraits of variations like “inquiring love,” “qualified love” and “modern love.” THE THREE MUSKETEERS By Alexandre Dumas. (Pegasus Books, $26.95.) The classic French epic in a new translation by Lawrence Ellsworth brings freshness to the story of d’Artagnan and his pals. THE RUIN OF KASCH By Roberto Calasso. (Farrar, Straus & Giroux, $17.) Calasso’s nearly four-decade project, eclectic and erudite, to tell the intellectual history of the modern world began with this first book in the series, about the French Revolution and so much more, translated anew into English. In which we ask colleagues at The Times what they’re reading now. “No book did more to steel me as an anti-Trump conservative writer than NOT I, the historian Joachim Fest’s devastating memoir of his coming of age in the Third Reich. Fest’s father, Johannes, was the quintessential ‘good German’ — an educated Prussian Catholic with a rightward political bent — who nevertheless refused to bend a knee (or raise a salute) to Hitler. The result was the loss of his job, social ostracism and penury. Fest, who died in 2006, captured his father’s struggles to preserve the family’s moral integrity and political decency in the face of a regime determined to strip it of both. At one point, in 1936, Fest’s mother pleads with Johannes to join the Nazi Party, despite his hatred of it, just to save her and their children from further hardship. Characterizing his mother’s argument, Fest writes, ‘Untruth has always been the weapon of the little people against the powerful.’ Johannes’s unforgettable rejoinder: ‘We are not little people. Not when it comes to such questions!’ Words to live by for anyone living in politically dark times.” — Bret Stephens, columnist ",https://www.nytimes.com/2017/12/26/books/review/new-noteworthy-bret-stephens.html?searchResultPosition=69
"Good morning. Here’s what you need to know: • The Department of Homeland Security is increasingly going global. Set up to defend the United States, the department now has an estimated 2,000 employees deployed to more than 70 countries around the world. The costs of the operations have raised questions by critics in the U.S., and by some allies who say the department’s foreign reach is a stretch. _____ • The Islamic State is far from being vanquished in Afghanistan, even as it is on the run in its core territory in Iraq and Syria. The group has waged brutal attacks that have displaced thousands of families and forced even some Taliban fighters to seek government protection. Above, some of the men fighting against the Islamic State. ",https://www.nytimes.com/2017/12/26/briefing/india-nikki-haley-north-korea.html?searchResultPosition=70
"ABOARD A P-3 ORION, over the Pacific Ocean — The Department of Homeland Security is increasingly going global. An estimated 2,000 Homeland Security employees — from Immigration and Customs Enforcement special agents to Transportation Security Administration officials — now are deployed to more than 70 countries around the world. Hundreds more are either at sea for weeks at a time aboard Coast Guard ships, or patrolling the skies in surveillance planes above the eastern Pacific Ocean and the Caribbean Sea. The expansion has created tensions with some European countries who say that the United States is trying to export its immigration laws to their territory. But other allies agree with the United States’ argument that its longer reach strengthens international security while preventing a terrorist attack, drug shipment, or human smuggling ring from reaching American soil. “Many threats to the homeland begin overseas, and that’s where we need to be,” said James Nealon, the department’s assistant secretary for international engagement. A surveillance mission earlier this month with Homeland Security agents in drug transit zones near South America highlights the department’s efforts to push out the border. Just after takeoff from a Costa Rican airfield, a crew of agents aboard a Customs and Border Protection surveillance plane began tracking a low-flying aircraft that appeared to be headed south toward Ecuador. ",https://www.nytimes.com/2017/12/26/world/americas/homeland-security-customs-border-patrol.html?searchResultPosition=71
"How did pop culture look from inside the White House and the halls of Congress in 2017? After a year as Times reporters covering Washington, we recently shared our analysis with Patrick Healy, a deputy Culture editor and former political reporter. PATRICK HEALY For starters, let’s have fun: What’s something about culture and politics in 2017 that most people don’t know? KATIE ROGERS Melania Trump recently told me her favorite show is “How to Get Away With Murder.” I love that the first lady is a Shondaland fan. She also enjoys “Empire.” And reality TV did not come up once. MATT FLEGENHEIMER Robert Mueller and Freud both reading this with interest. HEALY What do you make of her tastes, Katie? ROGERS “Empire” is juicy, outlandish drama. Escapism, almost. Larger-than-life personalities, too. Which is interesting for a first lady who is very much not into the spotlight, but is surrounded by very big personalities. ",https://www.nytimes.com/2017/12/26/arts/donald-trump-melania-pop-culture-2017.html?searchResultPosition=72
"RICHMOND, British Columbia — What sort of karaoke joint offers 18 kinds of bubble tea but only one Abba song? If you’re a Chinese immigrant living in metropolitan Vancouver, then you’ve probably already been there: Party World KTV, a branch of the Asian karaoke chain, which looks as if a wedding-cake-inspired U.F.O. had just landed in the middle of this majority ethnic-Chinese city. It’s a popular destination for anyone looking to warble a favorite Chinese pop song, accompanied by music videos occasionally set in the Ming dynasty and frequently featuring people crying. On a recent Friday night, anyone meant Karns You, a bleach-blond transplant from China’s coastal Guangdong Province. He was on his feet, eyes closed, belting out a rock ballad by the Hong Kong pop star Eason Chan. His girlfriend sat beside him, transfixed by her smartphone. Not that it mattered — Mr. You was there for karaoke, or KTV as it’s known in China, a guilty pleasure he indulges in often four times a week. “Sometimes you just want to sing, and then sing more,” said Mr. You, 30, who works for his uncle’s construction company, after his microphone session had ended. “KTV is the best way to get rid of stress.” ",https://www.nytimes.com/2017/12/26/world/canada/canada-chinese-karaoke.html?searchResultPosition=73
"Senator Orrin G. Hatch was named The Salt Lake Tribune’s “Utahn of the Year” on Monday, but the title was not intended as a compliment. The scathing editorial not only called for Mr. Hatch to step down — or for voters to oust him in 2018 — but also stated that he had an “utter lack of integrity that rises from his unquenchable thirst for power.” Mr. Hatch, a Republican, said on Twitter that he was “grateful for this great Christmas honor from the Salt Lake Tribune.” His reaction led many to think that he had not read past the headline, and inspired ridicule online. ",https://www.nytimes.com/2017/12/26/us/politics/orrin-hatch-salt-lake-tribune.html?searchResultPosition=68
"It was supposed to be a tax cut for manufacturers. Then it got out of control. World Wrestling Entertainment took it for producing wrestling videos. Regional gas stations claimed it because they mix ethanol with base fuel. Grocery stores asked for it because they spray their fruit so that it ripens. Pharmacies could take it because they have booths that print photos. Republicans in Congress passed that deduction more than a decade ago, and they repealed it in the tax bill signed on Friday by President Trump. It is a lesson in the abundant creativity of American business in interpreting the tax code. The latest overhaul could play out the same way. Already, lawyers and accountants are eyeing several provisions that investors and companies could potentially exploit. The bill, for example, lowers the taxes on so-called pass-through income, which is earned by partnerships and other types of businesses. Congress sold the provision as a way to help smaller companies. But lawmakers added language that allowed big real estate developers to benefit. The result could be a tax break for any company that buys and operates a building for its business. The new law is also supposed to encourage companies to make investments in the United States. But the rules were written in such a way that they could give businesses an incentive to keep their money in foreign countries and build factories abroad. The wildly popular manufacturing break, passed in 2004, is a case study in the unforeseen consequences of changing the tax code — how companies take advantage of gaping holes and force the government to play catch-up. ",https://www.nytimes.com/2017/12/27/business/economy/tax-loopholes.html?searchResultPosition=42
"(Want to get this briefing by email? Here’s the sign-up.) Good evening. Here’s the latest. 1. President Trump insists that the Affordable Care Act is “essentially” being repealed. But what remains of it appears relatively stable and looks more and more like government-run health care. Tech companies are angling to get a bigger share of the $3 trillion spent on health care each year in the U.S. They’re racing to introduce new tracking apps, sensors and other tools. _____ 2. Small farmers say they’re drowning in federal rules and regulations. We visited Indian Ladder Farms, an orchard in upstate New York that, by our count, is subject to about 5,000 of them. ",https://www.nytimes.com/2017/12/27/briefing/health-care-barack-obama-jerusalem.html?searchResultPosition=41
"In a jab at President Trump’s promises to crack down on illegal immigration, Gov. Andrew M. Cuomo on Wednesday pardoned 18 immigrants in an effort to free them from the threat of deportation or other immigration-related issues. The pardons targeted those who had committed low-level offenses and had demonstrated significant rehabilitation since their convictions, Alphonso David, the governor’s chief counsel, said in an interview. “New York is a state of immigrants,” Mr. David said. “And most of these individuals made mistakes decades ago, and have been contributing members to our society.” With the new slate of pardons, Mr. Cuomo nearly tripled the number he had issued explicitly to stave off deportations, his office said. Before Wednesday, the governor had pardoned seven people for that purpose. This is the second time that the governor has wielded clemency as a direct rebuke to Mr. Trump’s immigration policies. The president has directed immigration officials to prioritize the deportation of any undocumented immigrants convicted of crimes, even low-level ones. In June, Mr. Cuomo pardoned Carlos Cardona, an immigrant from Colombia who had volunteered with Sept. 11 recovery efforts and who had been detained by immigration officials since February. Mr. Cardona had spent 45 days in jail after pleading guilty to selling a small amount of cocaine to an undercover officer. ",https://www.nytimes.com/2017/12/27/nyregion/trump-cuomo-pardons-immigrants.html?searchResultPosition=40
"For much of Silicon Valley, 2017 felt like a nonstop parade of scandal and sin. There was the decline of Uber, which blew itself up with missteps that included reports of rampant sexual harassment and executive misbehavior. There were troubles at Facebook, which became a lightning rod for failing to keep its platform safe from Russian propagandists and global extremists, and at Twitter and YouTube, which spent much of the year fighting to cleanse themselves of neo-Nazis, child exploiters and other undesirables. But tech wasn’t all bad this year. As many of Silicon Valley’s largest companies were wreaking havoc, numerous people and organizations used technology to advance important causes and address large-scale problems. These projects do not always make headlines, but they show what’s possible when technologists use their powers for good. So I’m presenting the first-ever Actually Good Tech Awards, to highlight a handful of tech efforts that produced real societal benefits this year. Let’s have more of these in 2018, and fewer behemoths behaving badly. An estimated 10 million Americans are blind or visually impaired, and until recently, tech companies did not have much to offer them. But that’s changing, thanks to start-ups like eSight and Aira, two companies that are taking advantage of recent advances in mobile and imaging technology to help visually impaired people navigate the world. Aira, a start-up in San Diego, provides “visual interpreters” through an on-demand subscription service. Users wear camera-equipped glasses that shares what they see over a built-in wireless connection with a sighted person who then describes the surroundings or guides them through complicated tasks in real time. The company raised $12 million in a funding round earlier this year, and recently struck a partnership with Lyft to improve the ride-hailing service’s accessibility. ESight, a company in Toronto, is building technology for legally blind people, who have impaired sight but have not fully lost their vision. ",https://www.nytimes.com/2017/12/27/technology/tech-roundup-2017.html?searchResultPosition=39
"The Internal Revenue Service has a message for the homeowners rushing to prepay their property taxes before new rules take effect on New Year’s Day: Not so fast. The tax bill that President Trump signed into law last week sharply limited the itemized deductions for state and local taxes while raising the standard deduction for individuals and couples. Those rules do not take effect until 2018, however. That has led some homeowners, particularly in high-tax, affluent areas, to try to prepay their 2018 property taxes before the deduction disappears. In an advisory notice posted to its website on Wednesday, the I.R.S. said that maneuver could work, but only under limited circumstances. To qualify for the deduction, property taxes not only need to be paid in 2017, they must also be assessed in 2017 — meaning that homeowners who prepaid their taxes based on estimated assessments, or who tried to pay several years’ worth of taxes at once, will probably be out of luck. “Those individuals now are not getting the benefits of those prepayments,” Nicole Kaeding, an economist at the Tax Foundation, said of people who paid taxes that had not yet been assessed. “All that you’ve done is provided an interest-free loan to your municipal government.” It is not clear how many people have tried to prepay their taxes. In Fairfax, Va., hundreds of people lined up to prepay taxes on Tuesday, according to local media reports, and communities in New York, New Jersey and other states have likewise reported a rush of prepayments. Some states have encouraged residents to try to skirt the new cap on state and local tax deductions. Last week, Gov. Andrew M. Cuomo of New York signed an executive order paving the way for residents to prepay their property taxes. ",https://www.nytimes.com/2017/12/27/business/prepaying-your-property-taxes-irs-cautions-it-might-not-pay-off.html?searchResultPosition=32
,https://www.nytimes.com/2017/12/27/us/joy-villa-corey-lewandowski.html?searchResultPosition=35
"When Mayor Bill de Blasio is sworn in for a second term on Monday, the oath will be administered by Senator Bernie Sanders of Vermont — a choice that perhaps reflects the shifting political winds in the Democratic Party. Four years ago, the former president Bill Clinton administered the oath, with Hillary Clinton looking on. At the time, Mrs. Clinton was the smart-money pick to become the next president. That didn’t work out. Along the way, Mr. de Blasio was late to endorse Mrs. Clinton’s 2016 presidential campaign, as other progressive Democrats were flocking to Mr. Sanders. After Mrs. Clinton lost to Donald J. Trump last November, Mr. de Blasio consummated his embrace of Mr. Sanders and the Democratic Party’s left wing. Mr. Sanders’s presence may further speculation that Mr. de Blasio has his gaze on goals beyond New York City. Despite criticism, Mr. de Blasio has persisted in seeking a national political role for himself. He has made himself a liberal foil for President Trump, taking him on over issues like immigration and tax policy. Earlier this month Mr. de Blasio traveled to Iowa, where he spoke before Progress Iowa, a group that, like the mayor, wants to steer Democratic politics to the left. He has denied that he plans to run for president, but paying visits to Iowa — the state that traditionally holds the first presidential nominating contest — is a common gambit for presidential hopefuls. “Senator Sanders’ progressive leadership has helped reshape the American political debate in favor of men and women long left out of our city and nation’s prosperity,” Mr. de Blasio said in a statement released on Wednesday. ",https://www.nytimes.com/2017/12/27/nyregion/bernie-sanders-de-blasio-inauguration.html?searchResultPosition=34
"At the 1992 Republican National Convention, Pat Buchanan famously declared that American politics had become a “cultural war.” In the years since, social issues and identities have become more important in dividing Democrats from Republicans. Traditionally, the two parties fought mostly over economics. But now cultural issues like abortion and gun control divide Americans more sharply along regional lines than economic policies. One impact of the rise of the culture war in the 1990s was to reorder the popular coalitions of the parties — for example, by attracting evangelical Protestants to the Republicans while propelling secular voters toward the Democrats. This also redefined their geographic constituencies. But while it has been fueled by widening divisions over social issues within the American electorate, this regional realignment has left a much larger imprint on the direction of federal economic policy than on the nation’s prevailing cultural zeitgeist. You might say that the winner of the culture wars is neither Democrats nor Republicans. In legislative terms, American corporations have claimed the biggest victories so far. The growing sectional divide — the coasts and a handful of Midwestern and Mountain West states vote blue, while voters in the culturally conservative heartland of the South and interior West largely vote red — is magnified by winner-take-all electoral rules that concentrate representation in the hands of local partisan majorities. The Alabama Senate race was an exception, but this largely produces a stable arrangement of “red” and “blue” states and districts that seldom deviate from their normal partisan alignments regardless of the individual candidates seeking office. On balance, the trend of rising geographic polarization has worked to the advantage of Republicans in both houses of Congress. The Republican Party has captured more seats in culturally conservative red America than it has relinquished in culturally liberal blue America, allowing it to control at least one legislative chamber in all but four years since 1994 after six decades of near-permanent minority status. ",https://www.nytimes.com/2017/12/27/opinion/culture-war-corporate-america.html?searchResultPosition=36
