,text,link
71,"To many Americans, February, first officially recognized by President Gerald Ford in 1976 as Black History Month, is a time to celebrate African-American achievements, ones that were gained against nearly impossible economic, social and political odds. But there is one achievement that is rarely on the list. As a people, African-Americans forced the United States of America to look deep into its own soul and to see the moral bankruptcy that lay there. That bankruptcy was exposed as African-Americans struggled to live under white supremacy, a system that rendered them “sub-persons.” And even as we fought to make America “our home” — a home that was already brutally taken from Native Americans by white colonial settlers — our black bodies were subject to unconscionable white enslavement, violence and oppression; we lived through forms of carnage, mutilation, rape, castration and injustice that will forever mark the profound ethical failure of this country. By surviving, and demonstrating that the American experiment had failed black people and minorities, we became far more American than those who withheld America’s promise. On paper, America stood for freedom. Yet that freedom was denied to black people. White America, white people, lived in a profound form of what Sartre called “bad faith” — a state of inauthenticity and self-deception. The white social critic Lillian Smith (1896-1966), who grew up in the Deep South and later wrote “Killers of the Dream,” observed, “I had learned that God so loved the world that he gave his only begotten son so that we might have segregated churches.” She also noted, “I learned it is possible to be a Christian and a white Southerner simultaneously” and “to pray at night and ride Jim Crow car the next morning and to feel comfortable in doing both.” It is this bad faith, this ethical perversity, that haunts the history of white America. And as Frederick Douglass noted, “Between the Christianity of this land and the Christianity of Christ, I recognize the widest possible difference.” And in his speech “What to the Slave Is the Fourth of July” (1852), Douglass said to white America: “The Fourth of July is yours, not mine. You may rejoice, I must mourn.” As I listened to President Trump’s Black History Month remarks on Feb. 1, it was painfully clear that he didn’t bear witness to that Douglass. It is convenient for him not to know that Douglass. In this nightmare of Trumpism, we mustn’t forget Douglass’s words, just as we mustn’t forget the dejection felt by those who suffered under the Chinese Exclusion Act of 1882 or in the anti-Japanese internment camps during World War II. Those actions contradicted America’s alleged identity as a nation whose arms are open to the stranger, the outcast; a nation that, in theory, does not discriminate based upon race or national origin. It is this brutal and contradictory history from which America cannot, and should not, turn away. Just as Jews refuse to forget Hitler’s Germany, we black Americans refuse to forget the often unspeakable atrocities we endured. It is this resistance to forgetting that must be nurtured as we find ourselves in the midst of a dangerous form of antiglobalism, white nativism and xenophobia under Trump’s vision for making America “great again,” a vision closer to D. W. Griffith’s 1915 “The Birth of a Nation” — a film predicated upon white fear and denigration of the black other — than that of an actual nation. ",https://www.nytimes.com/2017/02/09/opinion/its-black-history-month-look-in-the-mirror.html?searchResultPosition=58
72,"Is President Trump trying to make enemies of the entire Muslim world? That could well happen if he follows up his primitive ban on refugees and visa holders from seven Muslim nations with an order designating the Muslim Brotherhood — perhaps the most influential Islamist group in the Middle East — as a terrorist organization. Such an order, now under consideration, would be seen by many Muslims as another attempt to vilify adherents of Islam. It appears to be part of a mission by the president and his closest advisers to heighten fears by promoting a dangerously exaggerated vision of an America under siege by what they call radical Islam. The struggle against extremism is complex, and solutions must be tailored both to the facts and to an understanding of the likely consequences. Since 1997, the secretary of state has had the power to designate groups as foreign terrorist organizations, thus subjecting them, as well as people and businesses who deal with them, to sanctions, like freezing their assets. President Barack Obama resisted adding the Brotherhood to that list. There are good reasons that the Brotherhood, with millions of members, doesn’t merit the terrorist designation. Rather than a single organization, it is a collection of groups and movements that can vary widely from country to country. While the Brotherhood calls for a society governed by Islamic law, it renounced violence decades ago, has supported elections and has become a political and social organization. Its branches often have tenuous connections to the original movement founded in Egypt in 1928. Under State Department guidelines, the “terrorist” designation is intended to punish groups that carry out terrorist attacks. There’s no question that some such groups have grown out of the Muslim Brotherhood, like Hamas, the adversary of Israel, which the United States named a terrorist organization in 1997. Egypt’s president, Abdel Fattah el-Sisi, has worked to crush the Brotherhood in his country since he overthrew his predecessor, Mohamed Morsi, a former Brotherhood leader, in 2013. But there is no evidence that senior Brotherhood leaders ordered any violence or carried out any of the recent major terrorist attacks in Egypt, according to the analysts Michele Dunne and Nathan Brown of the Carnegie Endowment for International Peace. ",https://www.nytimes.com/2017/02/09/opinion/all-of-islam-isnt-the-enemy.html?searchResultPosition=57
73,"Among global public health advocates, there is a growing concern that President Trump may cut back, or even eliminate, programs that have played a critical role in fighting diseases worldwide. While every administration should strongly review our nation’s overseas commitments, and there are undoubtedly programs that we should cut, I hope he recognizes the success and importance of one in particular: the President’s Emergency Plan for AIDS Relief. I have been treating patients in Africa and Haiti for 20 years. When I was Senate majority leader in 2003, I led the Senate’s passage of the plan, called Pepfar, on an overwhelming voice vote. It has since been reauthorized twice. President Trump, like his predecessors, will have the chance to put his own stamp on this winning program. Pepfar was created in a moment of crisis: In the late 1990s, H.I.V.-AIDS was the No. 4 killer worldwide, and No. 1 in Africa. The program aimed to bring reliable, proven measures like antiretroviral drugs, counseling and prevention services to underserved communities around the world — and it worked. Today, Pepfar reaches 11.5 million people with antiretroviral drugs, a 50 percent increase since just 2014. Two million babies with infected mothers have been born H.I.V.-free thanks to Pepfar interventions, and 6.2 million orphans and vulnerable children receive care from the program. The program has been able to expand, without a significant change in its budget, because it leverages the latest scientific innovations and reductions in drug prices. As a result, the rate of new H.I.V. infections in Malawi, for example, has dropped 76 percent in 13 years. But the work is far from over. One million people worldwide died of AIDS last year, and only about half of those afflicted with the disease are getting proper treatment. Pepfar’s success is no secret to the new administration. In his confirmation hearing as secretary of state last month, Rex Tillerson called it “a model for us to look to as we’re thinking about other ways in which to project America’s values, project our compassion” to “solve these threats.” A few days later, though, The New York Times reported that the Trump transition team was asking questions about the value of humanitarian aid in general and Pepfar in particular. For example, transition officials asked, “Is Pepfar worth the massive investment when there are so many security concerns in Africa?” ",https://www.nytimes.com/2017/02/09/opinion/bill-frist-the-case-for-keeping-americas-aids-relief-plan.html?searchResultPosition=56
74,"It’s a dark and dismal time for American liberals. Except for the part where the opposition keeps shooting itself in the foot. We will now pause to contemplate the fact that this week the Senate Republicans attempted to forward their agenda by silencing Elizabeth Warren while she was reading a letter from Martin Luther King Jr.’s widow. In explanation, Majority Leader Mitch McConnell basically called Warren a pushy girl. Talk about the gift that keeps on giving. Never has a political party reached such a pinnacle of success, and then instantly begun using it to inspire the opposition. We’re less than three weeks into the Trump administration, and almost every day the people in power stop delivering the message of the day and veer off into a Strange Tale. Which do you think the Democrats found most empowering — Trump’s first full day in the White House, when he marched off to the C.I.A. to deliver a rambling tirade about the inauguration crowd size? The Holocaust Remembrance Day proclamation that eliminated any reference to the Jews? Or the new Supreme Court nominee saying the president who named him was being “demoralizing” and “disheartening”? ",https://www.nytimes.com/2017/02/09/opinion/elizabeth-warren-persists.html?searchResultPosition=55
75,"LONDON — Christie’s sold 4 billion pounds of art and collectibles in 2016, the international auction house said on Thursday, a decline of 16 percent from the previous year. In its 250th anniversary year, Christie’s described the process of wooing auction sellers as “challenging,” which may account for sales contracting 22 percent, to £3.3 billion, or about $4.1 billion. Auction sales were also down in 2016 at the rival houses Sotheby’s and Phillips. Private transactions at Christie’s, however, increased 25 percent, to £694 million. The largest of these was the joint acquisition for 160 million euros, or $170.8 million, of Rembrandt’s wedding portraits of Marten Soolmans and Oopjen Coppit by the Louvre Museum in Paris and the Rijksmuseum in Amsterdam. “It was a solid year. We achieved four out of the year’s five top auction prices,” said Guillaume Cerutti, Christie’s chief executive. Mr. Cerutti, 50, took over from Patricia Barbizet in December, having been the auction house’s president of Europe, Middle East, Russia and India operations. “The market is strong on the buyer’s side, more challenging on the seller’s side,” he added. Christie’s 2016 auction results were notable for the absence of 20th-century masterworks, such as Picasso’s “Les Femmes d’Alger (Version ‘O’),” which sold in 2015 for $179.4 million, a record for a work of art sold at auction. Last year, with Britain’s referendum on European Union membership and the United States’ presidential election creating uncertainty, owners of the world’s most valuable postwar and contemporary art were more reluctant to sell at auction. Was that also a consequence of Christie’s and third parties becoming more reluctant to guarantee minimum prices at the highest level, as had been the case with that Picasso? ",https://www.nytimes.com/2017/02/09/arts/christies-sothebys-phillips-2016-auction-sales.html?searchResultPosition=54
76,"The 2016 election deepened the chasm between those voters who believe that the government should address the problems of the poor and those who are convinced that the government already provides disadvantaged minorities with too much help, at the expense of the white working and middle classes. While the polarized belief systems that exploded in the battle between Trump and Clinton are driving both policymaking and an invigorated opposition, researchers continue to provide empirical evidence on the difficult issues of race, poverty and intergenerational mobility. Rucker C. Johnson, a professor of public policy at the University of California, Berkeley, has followed two generations of black families and concluded that integration has been an effective tool for raising educational levels and living standards. “Equal opportunity education policies generally are motivated to try to break the cycle of poverty, to break the vicious cycle of disadvantage from one generation to the next, and create a virtuous cycle where being born poor isn’t a life sentence,” Johnson told the annual meeting of the American Educational Research Association in 2016. “We have a very rare opportunity where a major intervention” — desegregation — “has been shown to be very effective on one generation’s lifetime outcomes, and then to be able to show that those beneficial effects extend into the next generation – particularly the black children whose parents went to desegregated schools.” Separate research published in 2015 by Johnson, C. Kirabo Jackson, an economist at Northwestern, and Claudia Persico, an economist at the University of Wisconsin, found that At the same time, Richard Reeves, a senior fellow at Brookings, and Dimitrios Halikias, a research assistant, tackled one of the most vexing issues in education in their February 2017 Brookings paper, “Race Gaps in SAT Scores Highlight Inequality and Hinder Upward Mobility.” “Race gaps on the SATs are especially pronounced at the tails of the distribution,” the two authors note. In math, for example, Translating those percentages into concrete numbers, Reeves and Halikias estimate that While the numbers Reeves and Halikias report are bleak, there are findings that suggest that these gaps can be ameliorated. ",https://www.nytimes.com/2017/02/09/opinion/integration-works-can-it-survive-the-trump-era.html?searchResultPosition=53
77,"This week, The New York Times is bingeing on late-night comedy shows and curating the best stuff in case you missed it. You need sleep, after all, and something in the news to smile about. We don’t need anything because we’re getting paid to watch late night which is insane. Do you like this feature? What do you want to see here? Let us know: thearts@nytimes.com Senator Elizabeth Warren’s thwarted attempt to read a Coretta Scott King letter on the Senate floor was Topic A for some late-night hosts Wednesday, as they ripped Republicans for silencing Ms. Warren’s challenge to the civil rights record of Senator Jeff Sessions of Alabama. Ms. Warren made a surprise appearance on “The Daily Show,” where Trevor Noah asked what she thought about several male senators being subsequently allowed to recite the letter. Mr. Colbert on the male senators: The CNN anchor Jake Tapper discussed his last two eventful days with Mr. Colbert: Grilling the Trump adviser Kellyanne Conway in an interview that went viral, and an Axios report that Republicans were now gunning for Mr. Tapper. The Twitter hashtag #TapperDirtFile is now encompassing all of the anchor’s supposed dirty laundry. Here are The Times Late-Night Comedy Committee’s favorite #TapperDirtFile tweets: ",https://www.nytimes.com/2017/02/09/arts/television/elizabeth-warren-letter-daily-show.html?searchResultPosition=52
78,"TOKYO — Yoshihiro Masui’s growling Ford hot-rod, its sides adorned with the Stars and Stripes, attests to his love of American cars — an unusual passion in Japan, where Toyota, Honda and other domestic brands rule the roads. “Japanese cars don’t break down, but they’re boring,” said Mr. Masui, 67, a semiretired music producer. Besides the hot-rod — a replica Model T with a racecar’s engine — he owns a gleaming white Ford Thunderbird, the latest of nearly 70 Detroit-made vehicles he figures he has bought and sold over the years. “You definitely stand out,” he said. Detroit pines for a day when the sight of an American car on a Japanese street is not so notable. Even as Japanese cars have taken a wide portion of the United States market, American brands are barely visible in Japan, a situation that has long frustrated American auto executives and trade negotiators and has become a renewed source of political friction under President Trump. Mr. Trump accuses Japan of shutting American producers out, by throwing up regulatory barriers and rigging the currency market in favor of Japanese brands. “They do things to us that make it impossible to sell cars in Japan,” he said in a meeting with American executives last month. Such talk is alarming in Japan, where the auto industry is a pillar of the economy. When Prime Minister Shinzo Abe meets Mr. Trump starting on Friday, averting a trade war will be at the top of his agenda. Mr. Abe’s government has been floating proposals, like using Japanese pension money to fund Mr. Trump’s infrastructure plans, that might mollify the president and help offset Japan’s large trade surplus. ",https://www.nytimes.com/2017/02/09/business/trump-japan-american-cars.html?searchResultPosition=51
79,"■ President Trump met with airline industry executives and complained that “we spent six trillion dollars in the Middle East, we got nothing.” ■ Representative Tom Price could finally get a vote as soon as Friday to be confirmed as secretary of health and human services. ■ Senator Chuck Schumer of New York, the Democratic leader, and Senator Patty Murray of Washington, the ranking Democrat on the labor committee, are going after Andrew Puzder, Mr. Trump’s embattled nominee for labor secretary. It was a bit of a kiss-and-tell moment when Senator Richard Blumenthal, Democrat of Connecticut, told reporters that President Trump’s nominee for the Supreme Court, Judge Neil M. Gorsuch, had called Mr. Trump’s attacks on the judiciary “demoralizing” and “disheartening.” The account was readily confirmed on the record by a White House adviser, Ron Bonjean, working to advance the Gorsuch confirmation. ",https://www.nytimes.com/2017/02/09/us/politics/donald-trump-administration.html?searchResultPosition=50
80,"The newly christened “Mnuchin rule” — the assurance given by the Treasury nominee Steven T. Mnuchin that “there would be no absolute tax cut for the upper class” — seems as if it was made to be broken. Mr. Mnuchin initially made the statement during an interview on CNBC in November, after President Trump chose him for the cabinet. At Mr. Mnuchin’s confirmation hearing, Senator Ron Wyden, an Oregon Democrat, rebranded the comment as a “rule,” transforming a throwaway line into a formal pledge. Whether it will be kept may become clearer in two or three weeks — the timing Mr. Trump mentioned Thursday for delivering a “phenomenal” tax plan. Although Mr. Mnuchin said any rate reductions at the top would be offset by the closing of fat loopholes, his guarantee appears impossible to fulfill either under the tax overhaul that the House Republicans are pushing or similar, sketchier proposals that Mr. Trump has offered. Redesigning the tax code with an eye fixed on lower rates has been a Republican mission for decades, and one that Mr. Trump adopted. That prospect, combined with a promised regulatory retreat, has pumped up the stock market and fueled optimism among business leaders. ",https://www.nytimes.com/2017/02/09/business/economy/mnuchin-rule-tax-cut.html?searchResultPosition=29
81,"For the first Summer of Trump, the Public Theater is choosing a play with a message. The theater, New York’s pre-eminent nonprofit, said Thursday that it would open its annual Shakespeare in the Park season with “Julius Caesar,” and declared, “Shakespeare’s political masterpiece has never felt more contemporary.” The Public’s synopsis of the play makes clear that the outdoor production would have some parallels with contemporary American politics. “Rome’s leader, Julius Caesar, is a force unlike any the city has seen,” the description reads. “Magnetic, populist, irreverent, he seems bent on absolute power. A small band of patriots, devoted to the country’s democratic traditions, must decide how to oppose him.” The play is an unusual choice for the annual summer program: During the 55 years of free theater in Central Park, “Julius Caesar” has been done just once, in 2000. And this summer’s production will be directed by Oskar Eustis, the Public’s artistic director, who last directed a show in the park in 2008 (“Hamlet”). “Julius Caesar” will be followed by more familiar summer fare: a production of “A Midsummer Night’s Dream,” directed by Lear deBessonet. The comedy was previously staged in the park in 1982, 1991 and 2007. “Julius Caesar” is to run from May 23 to June 18, and “A Midsummer Night’s Dream,” from July 11 to Aug. 13. Casting has not yet been announced. Most of the tickets to Shakespeare in the Park are distributed, for free, on the day of the performance, either in person or by a digital lottery. ",https://www.nytimes.com/2017/02/09/theater/julius-caesar-echoes-of-trump-in-central-park.html?searchResultPosition=28
82,"Though marred by spectacular corruption, Somalia’s presidential election on Wednesday managed to deliver a surprise result: Mohamed Abdullahi Mohamed, an American citizen who once worked for the New York State Department of Transportation and served as Somalia’s prime minister in 2010, beat the incumbent, Hassan Sheikh Mohamud. Mr. Mohamed now has the opportunity to form Somalia’s first functioning government in more than 25 years. With his election, there’s hope that Somalia can turn away from years of dysfunctional, corrupt leadership, and put in place a government that can tackle the country’s serious problems. Transparency International ranks Somalia the most corrupt country on earth. Some $20 million changed hands in the lead-up to Wednesday’s election, and bribe-taking, crony capitalism and the stealing of public money are deeply entrenched. Mr. Mohamed must move quickly to curb the corruption that has made it nearly impossible to provide basic services. Poverty and terrorism have made Somalia the world’s third-largest refugee-producing country after Syria and Afghanistan. More than one million Somalis have fled the country, many to neighboring Kenya. Famine, which caused the deaths of more than a quarter of a million Somalis in 2011, is again a severe threat because of continuing drought. The Al Qaeda-affiliated Shabab militant group, one of the world’s deadliest Islamist organizations, and other armed groups remain strong in Somalia, despite an intensified American clandestine war, in concert with African troops, against Islamist terrorists. On Tuesday, mortars landed near Mogadishu’s international airport, where lawmakers voted the next day. On Wednesday morning, militants attacked a hotel in Somalia’s semiautonomous region of Puntland, killing four guards. Somalia is one of seven countries on President Donald Trump’s legally contested travel ban list, causing profound anxiety for thousands of Somali refugees and for Somali families settled in the United States. There are also fears that Mr. Trump might move to cut American aid. That would be a mistake, especially now. Mr. Mohamed will need all the support he can get to put the government on a path to delivering the services and security Somalia needs. ",https://www.nytimes.com/2017/02/09/opinion/a-critical-juncture-for-somalia.html?searchResultPosition=35
83,"Good morning. Here’s what you need to know: • President Trump made the latest in a series of conciliatory signals toward China, writing in a letter to President Xi Jinping that he looked forward to developing a “constructive relationship.” The two have still not spoken by phone. Another widely noted gesture: Mr. Trump’s granddaughter Arabella sang a New Year’s greeting in Mandarin. Prime Minister Shinzo Abe of Japan meets Mr. Trump in Washington and then spends the weekend with him at his Florida resort, hoping to avert a trade war. In the automobile sector, marketing may be more of a factor than Japanese protectionism. _____ • Can Americans and Australians hold together what politics threatens to tear apart? That’s one of the questions our new bureau in Sydney is exploring after one of the most contentious weeks between the two countries in recent memory. ",https://www.nytimes.com/2017/02/09/briefing/tamil-nadu-afghanistan-israel.html?searchResultPosition=26
